title,description,url
Alex Israel of,The biggest baller east of the Mississippi,https://AlexIsraelov.com
Alex Israel,The biggest baller east of the Mississippi,https://AlexIsraelov.com
Cayden Pierce,Semantic lifestyle enthusiast and #1 Drake fangirl,https://caydenpierce.com
Kenji Fang,Perpetually on the grind (according to his website). Citation needed.,https://kenjiphang.vercel.app
Nicolo,really_really_likes_snake_case,https://github.com/nic-olo
Convoscope,"NSA spyware. Do not trust.",https://teamopensmartglasses.com/convoscope